{
  "$schema": "../../../schema/game-v1.0.json",
  "id": "baldurs-gate-ii-throne-of-bhaal",
  "title": "Baldur's Gate II: Throne of Bhaal",
  "filePath": "",
  "platformId": "",
  "collectionIds": [],
  "tags": [
    "Role-playing (RPG)",
    "Strategy"
  ],
  "metadata": {
    "description": "A storm of chaos and destruction thunders across the Sword Coast. As towns are laid to waste and great cities burn, there are whispered rumors that the Children of Bhaal are responsible.\nSoon the whispered rumors become panicked cries - if the prophecies of the Wise Alaundo are to be believed, there is greater suffering ahead. And should Bhaal somehow rise again, the earth itself will weep blood.\nIn the final chapter of the Bhaal saga, return to Baldur's Gate II: Shadows of Amn and unravel the mysteries of a dangerous new dungeon - Watcher's Keep.\nContinue with an exhilarating new adventure when you explore the unseen lands, encounter fierce villains, and gain powerful high-level abilities as you achieve your ultimate destiny in .. Baldur's Gate II: Throne of Bhaal.",
    "genre": [
      "Role-playing (RPG)",
      "Strategy"
    ],
    "developer": "BioWare",
    "publisher": "Interplay Entertainment",
    "releaseDate": "2001-06-21",
    "igdbId": 82,
    "primaryImage": "/api/images/baldurs-gate-ii-throne-of-bhaal/cover.jpg",
    "backdropImage": "/api/images/baldurs-gate-ii-throne-of-bhaal/screenshot_2.jpg"
  },
  "fileInfo": {
    "size": 0,
    "lastModified": "2025-10-31T07:35:52.953Z"
  },
  "created": "2025-10-31T07:35:52.953Z",
  "updated": "2025-10-31T07:36:13.056Z",
  "settings": {
    "launch": {
      "command": "",
      "arguments": [],
      "environment": {},
      "workingDirectory": ""
    }
  }
}
